{"$schema":"https://json-schema.org/draft/2020-12/schema","title":"C12 bound synthetic fact ledger","type":"object","additionalProperties":false,"required":["ledger_version","scope","case_sha256","elements_sha256","records"],"properties":{"ledger_version":{"const":"0.1.0"},"scope":{"const":"synthetic_fixture_only"},"case_sha256":{"type":"string","pattern":"^[a-f0-9]{64}$"},"elements_sha256":{"type":"string","pattern":"^[a-f0-9]{64}$"},"records":{"type":"array","maxItems":150,"items":{"type":"object","additionalProperties":false,"required":["document_ref","fact_key","value"],"properties":{"document_ref":{"type":"string","minLength":1},"fact_key":{"type":"string","minLength":3},"value":{"type":["string","integer","boolean"]}}}}}}
