{
  "case_sha256": "15f24f62bb1c1a27ceba748c8f2ec8853283ac5a355f54c3ff651b57ee32c63c",
  "elements_sha256": "936a217ede394dd5422ae3c9806207ba5a663bc28416f60c67be0c447046cf4b",
  "ledger_version": "0.1.0",
  "records": [
    {
      "document_ref": "synthetic:receipt",
      "fact_key": "element:procedure.channel",
      "value": "vfs"
    },
    {
      "document_ref": "synthetic:receipt",
      "fact_key": "fact:visa_fee_waiver_claimed",
      "value": true
    },
    {
      "document_ref": "synthetic:receipt",
      "fact_key": "fact:vfs_service_charge_recorded",
      "value": true
    },
    {
      "document_ref": "synthetic:receipt",
      "fact_key": "fact:vfs_route_optional",
      "value": true
    },
    {
      "document_ref": "synthetic:receipt",
      "fact_key": "fact:consular_visa_fee_collected",
      "value": false
    }
  ],
  "scope": "synthetic_fixture_only"
}
